"ONTOLOGY","ID","Description","GeneRatio","BgRatio","pvalue","p.adjust","qvalue","geneID","Count"
"BP","GO:0070304","positive regulation of stress-activated protein kinase signaling cascade","1/1","124/18870",0.00657127715951233,0.0139699979536901,NA,"3553",1
"BP","GO:0006690","icosanoid metabolic process","1/1","125/18870",0.00662427133015353,0.0139699979536901,NA,"3553",1
"BP","GO:0008286","insulin receptor signaling pathway","1/1","125/18870",0.00662427133015353,0.0139699979536901,NA,"3553",1
"BP","GO:0046683","response to organophosphorus","1/1","127/18870",0.00673025967143615,0.0140421874168,NA,"3553",1
"BP","GO:0002456","T cell mediated immunity","1/1","129/18870",0.00683624801271843,0.0140421874168,NA,"3553",1
"BP","GO:0002708","positive regulation of lymphocyte mediated immunity","1/1","129/18870",0.00683624801271843,0.0140421874168,NA,"3553",1
"BP","GO:0051224","negative regulation of protein transport","1/1","129/18870",0.00683624801271843,0.0140421874168,NA,"3553",1
"BP","GO:1990266","neutrophil migration","1/1","129/18870",0.00683624801271843,0.0140421874168,NA,"3553",1
"BP","GO:0002821","positive regulation of adaptive immune response","1/1","130/18870",0.00688924218335962,0.0140421874168,NA,"3553",1
"BP","GO:0071621","granulocyte chemotaxis","1/1","130/18870",0.00688924218335962,0.0140421874168,NA,"3553",1
"BP","GO:0046328","regulation of JNK cascade","1/1","132/18870",0.00699523052464224,0.01419032477856,NA,"3553",1
"BP","GO:1904950","negative regulation of establishment of protein localization","1/1","133/18870",0.00704822469528343,0.0142300650246007,NA,"3553",1
"BP","GO:0002702","positive regulation of production of molecular mediator of immune response","1/1","136/18870",0.00720720720720691,0.0144144144144138,NA,"3553",1
"BP","GO:0034219","carbohydrate transmembrane transport","1/1","136/18870",0.00720720720720691,0.0144144144144138,NA,"3553",1
"BP","GO:0070555","response to interleukin-1","1/1","140/18870",0.00741918388977214,0.0147003364513625,NA,"3553",1
"BP","GO:0071902","positive regulation of protein serine/threonine kinase activity","1/1","140/18870",0.00741918388977214,0.0147003364513625,NA,"3553",1
"BP","GO:0043405","regulation of MAP kinase activity","1/1","142/18870",0.00752517223105453,0.0147452699122017,NA,"3553",1
"BP","GO:0003158","endothelium development","1/1","143/18870",0.00757816640169584,0.0147452699122017,NA,"3553",1
"BP","GO:0014074","response to purine-containing compound","1/1","143/18870",0.00757816640169584,0.0147452699122017,NA,"3553",1
"BP","GO:0010565","regulation of cellular ketone metabolic process","1/1","144/18870",0.0076311605723367,0.0147452699122017,NA,"3553",1
"BP","GO:0034763","negative regulation of transmembrane transport","1/1","144/18870",0.0076311605723367,0.0147452699122017,NA,"3553",1
"BP","GO:0045834","positive regulation of lipid metabolic process","1/1","145/18870",0.00768415474297834,0.0147452699122017,NA,"3553",1
"BP","GO:0050671","positive regulation of lymphocyte proliferation","1/1","145/18870",0.00768415474297834,0.0147452699122017,NA,"3553",1
"BP","GO:0051783","regulation of nuclear division","1/1","146/18870",0.00773714891361943,0.0147803831264658,NA,"3553",1
"BP","GO:0062013","positive regulation of small molecule metabolic process","1/1","147/18870",0.00779014308426063,0.0147839666840187,NA,"3553",1
"BP","GO:0032946","positive regulation of mononuclear cell proliferation","1/1","148/18870",0.00784313725490193,0.0147839666840187,NA,"3553",1
"BP","GO:0038061","non-canonical NF-kappaB signal transduction","1/1","148/18870",0.00784313725490193,0.0147839666840187,NA,"3553",1
"BP","GO:0050768","negative regulation of neurogenesis","1/1","149/18870",0.00789613142554313,0.0148182906928695,NA,"3553",1
"BP","GO:0051092","positive regulation of NF-kappaB transcription factor activity","1/1","150/18870",0.00794912559618433,0.0148523136139233,NA,"3553",1
"BP","GO:0002705","positive regulation of leukocyte mediated immunity","1/1","151/18870",0.00800211976682541,0.0148548854431202,NA,"3553",1
"BP","GO:0050729","positive regulation of inflammatory response","1/1","152/18870",0.00805511393746661,0.0148548854431202,NA,"3553",1
"BP","GO:1903531","negative regulation of secretion by cell","1/1","152/18870",0.00805511393746661,0.0148548854431202,NA,"3553",1
"BP","GO:0032368","regulation of lipid transport","1/1","153/18870",0.00810810810810814,0.0148881640260951,NA,"3553",1
"BP","GO:0045807","positive regulation of endocytosis","1/1","155/18870",0.00821409644939042,0.0149538678950441,NA,"3553",1
"BP","GO:0051961","negative regulation of nervous system development","1/1","155/18870",0.00821409644939042,0.0149538678950441,NA,"3553",1
"BP","GO:0097530","granulocyte migration","1/1","156/18870",0.00826709062003173,0.0149863004431213,NA,"3553",1
"BP","GO:0007043","cell-cell junction assembly","1/1","157/18870",0.00832008479067303,0.0149871077206713,NA,"3553",1
"BP","GO:0090316","positive regulation of intracellular protein transport","1/1","158/18870",0.00837307896131401,0.0149871077206713,NA,"3553",1
"BP","GO:2001236","regulation of extrinsic apoptotic signaling pathway","1/1","158/18870",0.00837307896131401,0.0149871077206713,NA,"3553",1
"BP","GO:0008643","carbohydrate transport","1/1","159/18870",0.00842607313195542,0.0150188583858285,NA,"3553",1
"BP","GO:0007254","JNK cascade","1/1","163/18870",0.00863804981452032,0.0153325384207736,NA,"3553",1
"BP","GO:0050796","regulation of insulin secretion","1/1","165/18870",0.00874403815580282,0.0154562666156515,NA,"3553",1
"BP","GO:0070665","positive regulation of leukocyte proliferation","1/1","166/18870",0.00879703232644413,0.0154856850044017,NA,"3553",1
"BP","GO:0006633","fatty acid biosynthetic process","1/1","168/18870",0.00890302066772641,0.0155437983788994,NA,"3553",1
"BP","GO:0051168","nuclear export","1/1","168/18870",0.00890302066772641,0.0155437983788994,NA,"3553",1
"BP","GO:0030856","regulation of epithelial cell differentiation","1/1","171/18870",0.00906200317965022,0.0157567892021673,NA,"3553",1
"BP","GO:0051048","negative regulation of secretion","1/1","172/18870",0.00911499735029131,0.015784507606602,NA,"3553",1
"BP","GO:0043409","negative regulation of MAPK cascade","1/1","176/18870",0.00932697403285609,0.0160357836828422,NA,"3553",1
"BP","GO:0032635","interleukin-6 production","1/1","177/18870",0.00937996820349751,0.0160357836828422,NA,"3553",1
"BP","GO:0032675","regulation of interleukin-6 production","1/1","177/18870",0.00937996820349751,0.0160357836828422,NA,"3553",1
"BP","GO:0001837","epithelial to mesenchymal transition","1/1","178/18870",0.00943296237413871,0.0160357836828422,NA,"3553",1
"BP","GO:0006469","negative regulation of protein kinase activity","1/1","179/18870",0.00948595654477991,0.0160357836828422,NA,"3553",1
"BP","GO:0015718","monocarboxylic acid transport","1/1","179/18870",0.00948595654477991,0.0160357836828422,NA,"3553",1
"BP","GO:0042129","regulation of T cell proliferation","1/1","182/18870",0.00964493905670383,0.0161501773266476,NA,"3553",1
"BP","GO:0001659","temperature homeostasis","1/1","183/18870",0.0096979332273448,0.0161501773266476,NA,"3553",1
"BP","GO:1905952","regulation of lipid localization","1/1","183/18870",0.0096979332273448,0.0161501773266476,NA,"3553",1
"BP","GO:0045766","positive regulation of angiogenesis","1/1","185/18870",0.00980392156862753,0.0161501773266476,NA,"3553",1
"BP","GO:1904018","positive regulation of vasculature development","1/1","185/18870",0.00980392156862753,0.0161501773266476,NA,"3553",1
"BP","GO:0007565","female pregnancy","1/1","186/18870",0.0098569157392685,0.0161501773266476,NA,"3553",1
"BP","GO:0032872","regulation of stress-activated MAPK cascade","1/1","186/18870",0.0098569157392685,0.0161501773266476,NA,"3553",1
"BP","GO:0051302","regulation of cell division","1/1","186/18870",0.0098569157392685,0.0161501773266476,NA,"3553",1
"BP","GO:0002706","regulation of lymphocyte mediated immunity","1/1","188/18870",0.00996290408055112,0.0162234701711324,NA,"3553",1
"BP","GO:0046890","regulation of lipid biosynthetic process","1/1","189/18870",0.0100158982511921,0.0162234701711324,NA,"3553",1
"BP","GO:0070302","regulation of stress-activated protein kinase signaling cascade","1/1","189/18870",0.0100158982511921,0.0162234701711324,NA,"3553",1
"BP","GO:0002700","regulation of production of molecular mediator of immune response","1/1","191/18870",0.0101218865924746,0.0163186319167812,NA,"3553",1
"BP","GO:0071466","cellular response to xenobiotic stimulus","1/1","192/18870",0.0101748807631159,0.0163186319167812,NA,"3553",1
"BP","GO:0002822","regulation of adaptive immune response based on somatic recombination of immune receptors built from immunoglobulin superfamily domains","1/1","193/18870",0.0102278749337572,0.0163186319167812,NA,"3553",1
"BP","GO:0033673","negative regulation of kinase activity","1/1","193/18870",0.0102278749337572,0.0163186319167812,NA,"3553",1
"BP","GO:0090276","regulation of peptide hormone secretion","1/1","195/18870",0.0103338632750397,0.0164262155043542,NA,"3553",1
"BP","GO:0043123","positive regulation of canonical NF-kappaB signal transduction","1/1","196/18870",0.0103868574456808,0.0164490753600744,NA,"3553",1
"BP","GO:0002791","regulation of peptide secretion","1/1","198/18870",0.0104928457869634,0.0165553789083201,NA,"3553",1
"BP","GO:0030073","insulin secretion","1/1","199/18870",0.0105458399576044,0.016577593438891,NA,"3553",1
"BP","GO:0090087","regulation of peptide transport","1/1","200/18870",0.0105988341282459,0.0165996446273263,NA,"3553",1
"BP","GO:0032388","positive regulation of intracellular transport","1/1","201/18870",0.0106518282988872,0.0166215342685932,NA,"3553",1
"BP","GO:0032869","cellular response to insulin stimulus","1/1","206/18870",0.010916799152093,0.0169111143228786,NA,"3553",1
"BP","GO:0044703","multi-organism reproductive process","1/1","206/18870",0.010916799152093,0.0169111143228786,NA,"3553",1
"BP","GO:0002819","regulation of adaptive immune response","1/1","208/18870",0.0110227874933756,0.0170134328702102,NA,"3553",1
"BP","GO:0045732","positive regulation of protein catabolic process","1/1","210/18870",0.0111287758346581,0.017115012655467,NA,"3553",1
"BP","GO:0009612","response to mechanical stimulus","1/1","213/18870",0.0112877583465818,0.0171317750792094,NA,"3553",1
"BP","GO:0042098","T cell proliferation","1/1","213/18870",0.0112877583465818,0.0171317750792094,NA,"3553",1
"BP","GO:1901888","regulation of cell junction assembly","1/1","213/18870",0.0112877583465818,0.0171317750792094,NA,"3553",1
"BP","GO:0002064","epithelial cell development","1/1","214/18870",0.0113407525172231,0.0171317750792094,NA,"3553",1
"BP","GO:0045216","cell-cell junction organization","1/1","214/18870",0.0113407525172231,0.0171317750792094,NA,"3553",1
"BP","GO:0044706","multi-multicellular organism process","1/1","216/18870",0.0114467408585054,0.0172307830590929,NA,"3553",1
"BP","GO:1903828","negative regulation of protein localization","1/1","218/18870",0.011552729199788,0.017329093799682,NA,"3553",1
"BP","GO:0051348","negative regulation of transferase activity","1/1","225/18870",0.0119236883942765,0.0176542102860034,NA,"3553",1
"BP","GO:0033157","regulation of intracellular protein transport","1/1","226/18870",0.0119766825649178,0.0176542102860034,NA,"3553",1
"BP","GO:0042180","cellular ketone metabolic process","1/1","226/18870",0.0119766825649178,0.0176542102860034,NA,"3553",1
"BP","GO:0071222","cellular response to lipopolysaccharide","1/1","226/18870",0.0119766825649178,0.0176542102860034,NA,"3553",1
"BP","GO:0072330","monocarboxylic acid biosynthetic process","1/1","226/18870",0.0119766825649178,0.0176542102860034,NA,"3553",1
"BP","GO:0097191","extrinsic apoptotic signaling pathway","1/1","229/18870",0.0121356650768415,0.0177820850665328,NA,"3553",1
"BP","GO:0009743","response to carbohydrate","1/1","230/18870",0.0121886592474826,0.0177820850665328,NA,"3553",1
"BP","GO:0051403","stress-activated MAPK cascade","1/1","230/18870",0.0121886592474826,0.0177820850665328,NA,"3553",1
"BP","GO:0006909","phagocytosis","1/1","237/18870",0.0125596184419713,0.0181504154144371,NA,"3553",1
"BP","GO:0031098","stress-activated protein kinase signaling cascade","1/1","238/18870",0.0126126126126124,0.0181504154144371,NA,"3553",1
"BP","GO:0050670","regulation of lymphocyte proliferation","1/1","238/18870",0.0126126126126124,0.0181504154144371,NA,"3553",1
"BP","GO:0071219","cellular response to molecule of bacterial origin","1/1","239/18870",0.0126656067832537,0.0181504154144371,NA,"3553",1
"BP","GO:0030595","leukocyte chemotaxis","1/1","240/18870",0.0127186009538952,0.0181504154144371,NA,"3553",1
"BP","GO:0030072","peptide hormone secretion","1/1","241/18870",0.0127715951245362,0.0181504154144371,NA,"3553",1
"BP","GO:0032944","regulation of mononuclear cell proliferation","1/1","242/18870",0.0128245892951774,0.0181504154144371,NA,"3553",1
"BP","GO:0050769","positive regulation of neurogenesis","1/1","242/18870",0.0128245892951774,0.0181504154144371,NA,"3553",1
"BP","GO:0097529","myeloid leukocyte migration","1/1","242/18870",0.0128245892951774,0.0181504154144371,NA,"3553",1
"BP","GO:2001234","negative regulation of apoptotic signaling pathway","1/1","243/18870",0.0128775834658187,0.018165068067678,NA,"3553",1
"BP","GO:0051091","positive regulation of DNA-binding transcription factor activity","1/1","244/18870",0.01293057763646,0.0181796240037358,NA,"3553",1
"BP","GO:0002790","peptide secretion","1/1","246/18870",0.0130365659777423,0.0182683457451257,NA,"3553",1
"BP","GO:0002703","regulation of leukocyte mediated immunity","1/1","249/18870",0.0131955484896661,0.0184305037921238,NA,"3553",1
"BP","GO:0046883","regulation of hormone secretion","1/1","251/18870",0.0133015368309486,0.0184575071334987,NA,"3553",1
"BP","GO:0050870","positive regulation of T cell activation","1/1","251/18870",0.0133015368309486,0.0184575071334987,NA,"3553",1
"BP","GO:0010001","glial cell differentiation","1/1","252/18870",0.0133545310015899,0.0184708772944068,NA,"3553",1
"BP","GO:0006959","humoral immune response","1/1","258/18870",0.0136724960254371,0.018849460539923,NA,"3553",1
"BP","GO:0015833","peptide transport","1/1","262/18870",0.0138844727080021,0.0189576454282336,NA,"3553",1
"BP","GO:0048762","mesenchymal cell differentiation","1/1","262/18870",0.0138844727080021,0.0189576454282336,NA,"3553",1
"BP","GO:0090068","positive regulation of cell cycle process","1/1","262/18870",0.0138844727080021,0.0189576454282336,NA,"3553",1
"BP","GO:0043122","regulation of canonical NF-kappaB signal transduction","1/1","265/18870",0.0140434552199257,0.0190525857442304,NA,"3553",1
"BP","GO:0071216","cellular response to biotic stimulus","1/1","265/18870",0.0140434552199257,0.0190525857442304,NA,"3553",1
"BP","GO:0050708","regulation of protein secretion","1/1","266/18870",0.014096449390567,0.0190637696520049,NA,"3553",1
"BP","GO:0070663","regulation of leukocyte proliferation","1/1","267/18870",0.0141494435612082,0.0190748827755528,NA,"3553",1
"BP","GO:0032868","response to insulin","1/1","269/18870",0.0142554319024908,0.0191571419257447,NA,"3553",1
"BP","GO:0002699","positive regulation of immune effector process","1/1","270/18870",0.0143084260731317,0.0191678915319311,NA,"3553",1
"BP","GO:0140014","mitotic nuclear division","1/1","274/18870",0.0145204027556967,0.0193908826768865,NA,"3553",1
"BP","GO:1903039","positive regulation of leukocyte cell-cell adhesion","1/1","275/18870",0.0145733969263381,0.0194008346581876,NA,"3553",1
"BP","GO:0045860","positive regulation of protein kinase activity","1/1","282/18870",0.0149443561208266,0.0198326969080128,NA,"3553",1
"BP","GO:0071900","regulation of protein serine/threonine kinase activity","1/1","285/18870",0.0151033386327502,0.0199814355824583,NA,"3553",1
"BP","GO:0010721","negative regulation of cell development","1/1","287/18870",0.0152093269740328,0.0200593600338636,NA,"3553",1
"BP","GO:1903532","positive regulation of secretion by cell","1/1","288/18870",0.0152623211446742,0.020067125949479,NA,"3553",1
"BP","GO:0051962","positive regulation of nervous system development","1/1","290/18870",0.0153683094859565,0.0201443072031306,NA,"3553",1
"BP","GO:0030100","regulation of endocytosis","1/1","291/18870",0.0154213036565977,0.0201517649009528,NA,"3553",1
"BP","GO:0007249","canonical NF-kappaB signal transduction","1/1","300/18870",0.0158982511923689,0.0207114832047374,NA,"3553",1
"BP","GO:0001933","negative regulation of protein phosphorylation","1/1","304/18870",0.0161102278749335,0.0209236496180539,NA,"3553",1
"BP","GO:0030217","T cell differentiation","1/1","307/18870",0.0162692103868574,0.0209435516310075,NA,"3553",1
"BP","GO:0046651","lymphocyte proliferation","1/1","307/18870",0.0162692103868574,0.0209435516310075,NA,"3553",1
"BP","GO:0046879","hormone secretion","1/1","308/18870",0.0163222045574988,0.0209435516310075,NA,"3553",1
"BP","GO:0051222","positive regulation of protein transport","1/1","308/18870",0.0163222045574988,0.0209435516310075,NA,"3553",1
"BP","GO:0051047","positive regulation of secretion","1/1","310/18870",0.0164281928987809,0.0209533238768883,NA,"3553",1
"BP","GO:0071375","cellular response to peptide hormone stimulus","1/1","310/18870",0.0164281928987809,0.0209533238768883,NA,"3553",1
"BP","GO:0070372","regulation of ERK1 and ERK2 cascade","1/1","313/18870",0.0165871754107048,0.021034754426271,NA,"3553",1
"BP","GO:0002440","production of molecular mediator of immune response","1/1","314/18870",0.0166401695813458,0.021034754426271,NA,"3553",1
"BP","GO:0032943","mononuclear cell proliferation","1/1","314/18870",0.0166401695813458,0.021034754426271,NA,"3553",1
"BP","GO:0009914","hormone transport","1/1","319/18870",0.016905140434552,0.0211920588456717,NA,"3553",1
"BP","GO:0022409","positive regulation of cell-cell adhesion","1/1","322/18870",0.0170641229464759,0.0211920588456717,NA,"3553",1
"BP","GO:1904951","positive regulation of establishment of protein localization","1/1","324/18870",0.0171701112877584,0.0211920588456717,NA,"3553",1
"BP","GO:0060326","cell chemotaxis","1/1","325/18870",0.0172231054583997,0.0211920588456717,NA,"3553",1
"BP","GO:0042326","negative regulation of phosphorylation","1/1","327/18870",0.0173290937996818,0.0211920588456717,NA,"3553",1
"BP","GO:0060485","mesenchyme development","1/1","327/18870",0.0173290937996818,0.0211920588456717,NA,"3553",1
"BP","GO:0006913","nucleocytoplasmic transport","1/1","330/18870",0.0174880763116056,0.0211920588456717,NA,"3553",1
"BP","GO:0042742","defense response to bacterium","1/1","330/18870",0.0174880763116056,0.0211920588456717,NA,"3553",1
"BP","GO:0051169","nuclear transport","1/1","330/18870",0.0174880763116056,0.0211920588456717,NA,"3553",1
"BP","GO:0051251","positive regulation of lymphocyte activation","1/1","330/18870",0.0174880763116056,0.0211920588456717,NA,"3553",1
"BP","GO:0016042","lipid catabolic process","1/1","334/18870",0.0177000529941703,0.0211920588456717,NA,"3553",1
"BP","GO:0045787","positive regulation of cell cycle","1/1","334/18870",0.0177000529941703,0.0211920588456717,NA,"3553",1
"BP","GO:0046394","carboxylic acid biosynthetic process","1/1","334/18870",0.0177000529941703,0.0211920588456717,NA,"3553",1
"BP","GO:0051607","defense response to virus","1/1","334/18870",0.0177000529941703,0.0211920588456717,NA,"3553",1
"BP","GO:0071214","cellular response to abiotic stimulus","1/1","334/18870",0.0177000529941703,0.0211920588456717,NA,"3553",1
"BP","GO:0104004","cellular response to environmental stimulus","1/1","334/18870",0.0177000529941703,0.0211920588456717,NA,"3553",1
"BP","GO:0140546","defense response to symbiont","1/1","335/18870",0.0177530471648117,0.0211920588456717,NA,"3553",1
"BP","GO:0032386","regulation of intracellular transport","1/1","336/18870",0.017806041335453,0.0211920588456717,NA,"3553",1
"BP","GO:0070371","ERK1 and ERK2 cascade","1/1","336/18870",0.017806041335453,0.0211920588456717,NA,"3553",1
"BP","GO:0016053","organic acid biosynthetic process","1/1","337/18870",0.0178590355060942,0.0211920588456717,NA,"3553",1
"BP","GO:0033674","positive regulation of kinase activity","1/1","337/18870",0.0178590355060942,0.0211920588456717,NA,"3553",1
"BP","GO:0062012","regulation of small molecule metabolic process","1/1","337/18870",0.0178590355060942,0.0211920588456717,NA,"3553",1
"BP","GO:0042063","gliogenesis","1/1","338/18870",0.0179120296767357,0.0211959017841372,NA,"3553",1
"BP","GO:0019216","regulation of lipid metabolic process","1/1","342/18870",0.0181240063593003,0.0213873316040497,NA,"3553",1
"BP","GO:0071496","cellular response to external stimulus","1/1","346/18870",0.0183359830418653,0.0214712794636066,NA,"3553",1
"BP","GO:0032496","response to lipopolysaccharide","1/1","348/18870",0.0184419713831476,0.0214712794636066,NA,"3553",1
"BP","GO:0009895","negative regulation of catabolic process","1/1","349/18870",0.0184949655537889,0.0214712794636066,NA,"3553",1
"BP","GO:0045765","regulation of angiogenesis","1/1","349/18870",0.0184949655537889,0.0214712794636066,NA,"3553",1
"BP","GO:0045862","positive regulation of proteolysis","1/1","350/18870",0.0185479597244301,0.0214712794636066,NA,"3553",1
"BP","GO:0051235","maintenance of location","1/1","350/18870",0.0185479597244301,0.0214712794636066,NA,"3553",1
"BP","GO:0070661","leukocyte proliferation","1/1","350/18870",0.0185479597244301,0.0214712794636066,NA,"3553",1
"BP","GO:0046942","carboxylic acid transport","1/1","351/18870",0.0186009538950714,0.0214742719764239,NA,"3553",1
"BP","GO:0015849","organic acid transport","1/1","352/18870",0.0186539480657126,0.0214772483134962,NA,"3553",1
"BP","GO:0042886","amide transport","1/1","354/18870",0.0187599364069951,0.0214831529822041,NA,"3553",1
"BP","GO:1901342","regulation of vasculature development","1/1","354/18870",0.0187599364069951,0.0214831529822041,NA,"3553",1
"BP","GO:0090287","regulation of cellular response to growth factor stimulus","1/1","357/18870",0.0189189189189189,0.0216071299181219,NA,"3553",1
"BP","GO:0042176","regulation of protein catabolic process","1/1","364/18870",0.0192898781134073,0.0219718932521698,NA,"3553",1
"BP","GO:1902074","response to salt","1/1","366/18870",0.01939586645469,0.021979856622104,NA,"3553",1
"BP","GO:0002449","lymphocyte mediated immunity","1/1","368/18870",0.0195018547959723,0.021979856622104,NA,"3553",1
"BP","GO:0009306","protein secretion","1/1","368/18870",0.0195018547959723,0.021979856622104,NA,"3553",1
"BP","GO:0002237","response to molecule of bacterial origin","1/1","369/18870",0.0195548489666136,0.021979856622104,NA,"3553",1
"BP","GO:0035592","establishment of protein localization to extracellular region","1/1","369/18870",0.0195548489666136,0.021979856622104,NA,"3553",1
"BP","GO:1901653","cellular response to peptide","1/1","374/18870",0.0198198198198196,0.0222190611664294,NA,"3553",1
"BP","GO:0045936","negative regulation of phosphate metabolic process","1/1","376/18870",0.0199258081611021,0.0222218532462734,NA,"3553",1
"BP","GO:0010563","negative regulation of phosphorus metabolic process","1/1","377/18870",0.0199788023317434,0.0222218532462734,NA,"3553",1
"BP","GO:0071692","protein localization to extracellular region","1/1","377/18870",0.0199788023317434,0.0222218532462734,NA,"3553",1
"BP","GO:0002460","adaptive immune response based on somatic recombination of immune receptors built from immunoglobulin superfamily domains","1/1","380/18870",0.0201377848436672,0.0222823281646812,NA,"3553",1
"BP","GO:0002696","positive regulation of leukocyte activation","1/1","380/18870",0.0201377848436672,0.0222823281646812,NA,"3553",1
"BP","GO:0050863","regulation of T cell activation","1/1","381/18870",0.0201907790143084,0.0222830877204544,NA,"3553",1
"BP","GO:1903037","regulation of leukocyte cell-cell adhesion","1/1","382/18870",0.0202437731849494,0.0222838433508745,NA,"3553",1
"BP","GO:0002697","regulation of immune effector process","1/1","389/18870",0.020614732379438,0.0226335514404469,NA,"3553",1
"BP","GO:0050767","regulation of neurogenesis","1/1","390/18870",0.0206677265500794,0.0226335514404469,NA,"3553",1
"BP","GO:0031331","positive regulation of cellular catabolic process","1/1","396/18870",0.0209856915739267,0.0228058791083999,NA,"3553",1
"BP","GO:0050867","positive regulation of cell activation","1/1","396/18870",0.0209856915739267,0.0228058791083999,NA,"3553",1
"BP","GO:0050900","leukocyte migration","1/1","396/18870",0.0209856915739267,0.0228058791083999,NA,"3553",1
"BP","GO:2001233","regulation of apoptotic signaling pathway","1/1","398/18870",0.0210916799152094,0.0228627370073263,NA,"3553",1
"BP","GO:0006631","fatty acid metabolic process","1/1","401/18870",0.021250662427133,0.0229766045531946,NA,"3553",1
"BP","GO:0051090","regulation of DNA-binding transcription factor activity","1/1","406/18870",0.021515633280339,0.0232042019681631,NA,"3553",1
"BP","GO:0051347","positive regulation of transferase activity","1/1","414/18870",0.0219395866454691,0.0236016765428532,NA,"3553",1
"BP","GO:0007159","leukocyte cell-cell adhesion","1/1","419/18870",0.0222045574986751,0.0238265528827093,NA,"3553",1
"BP","GO:0050727","regulation of inflammatory response","1/1","425/18870",0.0225225225225224,0.0241070215944587,NA,"3553",1
"BP","GO:0030098","lymphocyte differentiation","1/1","429/18870",0.0227344992050872,0.024268680445151,NA,"3553",1
"BP","GO:0043434","response to peptide hormone","1/1","430/18870",0.0227874933757286,0.024268680445151,NA,"3553",1
"BP","GO:0009410","response to xenobiotic stimulus","1/1","434/18870",0.0229994700582935,0.0244333522315038,NA,"3553",1
"BP","GO:0009615","response to virus","1/1","436/18870",0.0231054583995759,0.0244801508558624,NA,"3553",1
"BP","GO:0031400","negative regulation of protein modification process","1/1","437/18870",0.0231584525702172,0.0244801508558624,NA,"3553",1
"BP","GO:0000280","nuclear division","1/1","441/18870",0.0233704292527821,0.0246430763903098,NA,"3553",1
"BP","GO:0015711","organic anion transport","1/1","443/18870",0.0234764175940645,0.0246884960880904,NA,"3553",1
